{"$schema":"https://json-schema.org/draft/2020-12/schema","$id":"https://acompanhantesex.com/schemas/bootstrap-manifesto.schema.json","type":"object","additionalProperties":false,"required":["$schema","schemaVersion","versao","ambiente","criadoEm","finalidade","estado","objetos"],"properties":{"$schema":{"type":"string","const":"https://acompanhantesex.com/schemas/bootstrap-manifesto.schema.json"},"schemaVersion":{"const":2},"versao":{"type":"string","pattern":"^2\\."},"ambiente":{"const":"nao-configurado"},"criadoEm":{"type":"string","format":"date-time"},"finalidade":{"type":"string","minLength":10},"estado":{"const":"bootstrap"},"objetos":{"type":"array","maxItems":0}}}
